id,description,code,code,unit_size,category,link,rank,price,cost,created_at,updated_at
0054529a-05e7-47cc-88cd-48a9ba7a9014,Señal fotoluminiscente soporte: pvc celtex 3 mm pictograma: vinil rotulado + cinta de doble en 4 puntos para su instalación,FTCD,FTCD,20x30cm,fotoluminiscente,https://tellsenales.com/seguridad/senal-fotoluminiscente-con-base-pvc-celtex-3mm/,0,7.5,3,2023-08-03 03:38:19.427,2024-08-24 21:32:54.098
0092b79f-95cf-476f-81f0-b1b18992c78f,"Rollo cinta reflectiva 4""x45.7mts grado prismático  (HIP) color Amarillo ambar - 3M - Cortado de rollo de 48""",CR4-3M-AM,CR4-3M-AM,und,cintas seguridad,,0,920,886,2024-03-06 15:24:08.975,2024-03-06 15:24:08.975
0351a31f-96ff-4209-820f-1929f3f702c9,"Contador de días sin accidentes fabricando con soporte compuesto de aluminio 4mm, impresión vinil laminado ( protección UV) y perfiles de aluminio para numeración.",CON-PAL120X60,CON-PAL120X60,120x60cm,seguridad,https://tellsenales.com/seguridad/letrero-informativo-contador-de-dias-sin-accidentes-en-acrilico/,0,280,160,2024-09-06 19:49:16.818,2024-09-06 19:49:42.643
03b96778-b925-4506-8b34-cba5d39e0178,"Cinta Peligro 5"" x 200 M. - color amarillo",CPAM200,CPAM200,rollo,cintas seguridad,https://tellsenales.com/seguridad/cinta-peligro-amarillo-o-rojo/,0,35,25,2023-08-03 03:38:19.427,2024-09-19 20:29:14.867
03f21572-c45f-412a-88e8-df33ac151ea9,"Señal tijeral doble cara - estructura de madera con liston 1 x2"" + banner 12 oz templado incluye ( 2 visagras )",TJ-BN-1X2,TJ-BN-1X2,20x30cm,obras,,0,80,80,2023-08-03 03:38:19.427,2023-08-03 03:38:19.427
041c75c9-9918-455b-bc71-b3e665d09261,"Rollo cinta reflectiva tipo i - grado ingenieria 2"" x45.7 mts 3M - color amarillo",CGI-3M-AM,CGI-3M-AM,rollo,cintas seguridad,https://tellsenales.com/seguridad/cinta-reflectiva-grado-ingenieria-2-x45-7mts-3m/,0,280,200,2023-08-03 03:38:19.427,2024-09-19 20:29:51.644
0435a0f4-aeec-425a-b81c-141e5687f4f5,Señal vinil arclad laminado (proteccion UV) c/ soporte pvc celtex espesor = 3 mm - Doble cara,PVC-DC,PVC-DC,20x30cm,seguridad,,0,5.5,3,2023-08-03 03:38:19.427,2023-08-03 03:38:19.427
04473bd8-3b1b-4a47-975c-1ec5196e7e8d,"Panel compuesto de aluminio - substrato de aluminio (PAL ) 4mm ",PAL60X90,PAL60X90,60x90cm,viales,https://tellsenales.com/seguridad/panel-aluminio-compuesto-sustrato-de-aluminio-4mm/,0,80,54,2023-08-03 03:38:19.427,2024-08-24 22:42:07.861
04d817ce-e769-44a9-944c-d585ac3179a7,"Señal Vertical Preventiva  soporte: fibra de vidrio 4 mm con refuerzo platina 1 1/2"" Lámina: Reflectiva tipo XI Diamond Grade - 3M , Pictograma: Reflectivo grado ingeniería",FDP80,FDP80,80x80cm,viales,https://tellsenales.com/seguridad/senal-preventiva-en-fibra-de-vidrio-4mm-con-lamina-reflectiva-hip/,0,460,400,2024-01-14 18:28:07.413,2025-01-02 02:32:19.902
05a90ff1-f608-40b9-9a01-62229cf9b2b8,"Cinta reflectiva 4"" x 45.7M. marca Reflexlite, color amarillo ambar",CR4-REF-AM,CR4-REF-AM,rollo,cintas seguridad,https://tellsenales.com/seguridad/cinta-reflectiva-4-pulgadas-10-cm-x-45-7mts-reflexlite/,0,320,180,2023-08-03 03:38:19.427,2024-09-19 20:27:55.8
062d3839-bdfc-41ac-a370-1485a95cd92f,"Cinta reflectiva 2"" x 45.7M. marca Reflexlite, color amarillo limón ",CRAL-4,CRAL-4,rollo,cintas seguridad,https://tellsenales.com/seguridad/cinta-reflectiva-4-pulgadas-10-cm-x-45-7mts-reflexlite/,0,320,320,2023-08-03 03:38:19.427,2024-08-24 23:22:22.907
067263ad-7b08-4004-902d-ebff2186a51a,"Cinta antideslizante color: negro de (5 cm)2"" x 18 mts",CANG,CANG,rollo,cintas seguridad,https://tellsenales.com/seguridad/cinta-antideslizante-2-pulgadas-5cm-x-18-metros/,0,60,30,2023-08-03 03:38:19.427,2024-08-24 23:21:02.086
069e6664-07de-4106-8f6b-3c6f20a4b3b8,Malla de seguridad delimitadora naranja ancho rollo 1 mt x 50 mts - delgado,MS-DEL,MS-DEL,und,proteccion vial,https://tellsenales.com/seguridad/malla-de-seguridad-narajando/,0,50,28,2023-08-03 03:38:19.427,2024-09-19 20:36:06.986
074167b2-fbf9-408a-9266-8062ec8d015a,Rollo Vinil brillante para corte - Reflexlite 61cm x 47.7M color:,RV60,RV60,und,viniles,https://tellsenales.com/seguridad/vinil-de-corte-reflexlite-61cm-x-45-7m/,0,200,147,2024-11-09 16:35:21.22348,2024-11-09 16:36:08.739
0747c2e1-3481-4c3f-a407-08ef7d78e48f,"Señal para obras Vinil + sobrelaminado ( Protección UV ) + soporte MDF ( trupan génerico ) 4MM + Marco de madera con liston 2x2""",tru-mm,tru-mm,150x80cm,obras,,0,180,75,2024-03-23 15:33:19.554,2024-03-23 15:33:19.554
0771cd14-caf5-4856-930d-50580609f276,Señal preventiva con lamina reflectiva tipo IV Grado Prismático  con soporte trupan  MDF ( génerico ) 5.5mm,TRU100X80,TRU100X80,100x80cm,obras,https://tellsenales.com/seguridad/senales-temporales-vinil-con-soporte-triplay-4mm-para-obras-y-construccion/,0,160,90,2024-10-10 21:17:46.066,2024-10-28 15:09:36.16
07781fe9-aba8-4c93-a589-e52ada77cc90,Señal Vertical Preventiva Lámina: Reflectivo tipo IV Alta Intensidad Prismático 3M (HIP) Soporte: Panel Aluminio Compuesto 4mm Pictograma: Reflectivo Grado Ingeniería,SHP75-3M,SHP75-3M,75X75cm,viales,https://tellsenales.com/seguridad/senal-preventiva-con-lamina-de-alta-intensidad-hip-y-soporte-sustrato-de/,9,260,202,2025-01-03 03:00:43.483,2025-01-03 03:01:20.065
07b0e3c0-6ccd-4789-be56-e59d385a021d,"Señal Vertical Preventiva Lámina: Reflectivo tipo IV Grado Prismático (HIP)  Soporte: fibra de vidrio 4mm con platina embebida de 1 1/2""x1/8"" Pictograma: Reflectivo Grado Ingenieria",FHP60,FHP60,60x60cm,viales,https://tellsenales.com/seguridad/senal-preventiva-en-fibra-de-vidrio-4mm-con-lamina-reflectiva-hip/,10,135,80,2023-08-03 03:38:19.427,2025-01-02 01:48:44.266
09863f68-a313-455d-b684-726e811907e5,"Señal reglamentaria soporte: fibra de vidrio 4 mm con refuerzo platina de 1 1/2 "" lamina: Reflectivo tipo IV alta intensidad prismatico ( HIP) marca 3M , pictograma: vinil rotulado",FHR-3M,FHR-3M,60x90cm,viales,https://tellsenales.com/seguridad/senal-reguladora-en-fibra-de-vidrio-4mm-con-lamina-reflectiva-hip/,0,250,200,2023-08-03 03:38:19.427,2024-08-24 22:48:46.966
09abb4f5-2aff-4831-aa69-a46ffe55555e,Señal vinil laminado aplicado en soporte acrilico de 2 mm con dobles de 5 cm y doble cara,AC-DD,AC-DD,20x30cm,convencionales,https://tellsenales.com/seguridad/senales-en-acrilico-en-diferente-espesores-2mm-or-3mm-or-5mm/,0,15,5,2023-08-03 03:38:19.427,2024-09-21 23:44:08.643
0a40c097-1168-4182-80d7-00ba661fbfb1,"Parante con base de concreto 45x45cm, liston 2"" x 2"" x 3 M.  - Pintando base zincromato + gloss patrón Zebra cada 50cm (blanco / negro ) ",PSC,PSC,und,seguridad,,0,65,40,2023-09-15 15:45:37.834,2024-07-25 18:58:52.961
0b3bebda-db8f-4605-a0cd-5784a4bddc64,Tablero de Estación de Emergencia 200x120cm  - Vinil Arclad laminado aplicado sobre soporte MDF Trupan de 10mm,EEM,EEM,und,obras,https://tellsenales.com/seguridad/tablero-de-estacion-de-emergencia-personalizable/,0,100,210,2024-10-21 17:17:43.362615,2024-10-21 17:17:43.362615
0c60ad5c-55a0-4563-be0e-0937ce1c78c5,Señal para obras vinil Arclad laminado con soporte triplay 4 mm,TR40X60,TR40X60,40x60cm,obras,https://tellsenales.com/seguridad/senales-temporales-vinil-con-soporte-triplay-4mm-para-obras-y-construccion/,0,17,9,2023-08-03 03:38:19.427,2024-10-03 21:29:35.451
0c65d131-ebba-4e83-bdd4-4765a4e59af7,Cono de seguridad de 12 pulgadas ( 30 cm ),CN-12,CN-12,und,proteccion vial,https://tellsenales.com/seguridad/cono-de-seguridad-naranja-12-30cm/,0,18,12,2023-08-03 03:38:19.427,2024-09-19 20:20:20.886
0d46c088-16d2-481c-8d4d-80f6bb9d8fd6,Señal fotoluminiscente tipo bandera ( doble cara y con dobles de 5 cm ) soporte: pvc celtex 3 mm pictograma: vinil rotulado,FTB20X30-3,FTB20X30-3,20x30cm,fotoluminiscente,https://tellsenales.com/seguridad/senal-fotoluminiscente-con-dobles-tipo-bandera-soporte-pvc-celtex-3mm-5mm/,0,14,6,2023-08-03 03:38:19.427,2024-08-24 14:22:53.063
0d898676-1d03-4c6e-833b-8ef682e2d28a,"Señal Vertical Preventiva  soporte: fibra de vidrio 4 mm con refuerzo platina 1 1/2"" Lámina: Reflectiva tipo XI Diamond Grade - 3M , Pictograma: Reflectivo grado ingeniería",FDP40,FDP40,40x40cm,viales,"Señal Vertical Preventiva  soporte: fibra de vidrio 4 mm con refuerzo platina 1 1/2"" Lámina: Reflectiva tipo XI Diamond Grade - 3M , Pictograma: Reflectivo grado ingeniería",0,115,75,2024-01-14 18:29:40.142,2025-01-02 02:33:24.566
0dabeea7-4903-4070-88ca-017745be98b2,"Señal vertical preventiva Soporte: fibra de vidrio 4 mm con refuerzo platina 1 1/2"" Lamina: retroreflectiva tipo IV Alta Intensidad Prismático ( HIP) Pictograma: vinil rotulado",FHP30,FHP30,30x30cm,viales,https://tellsenales.com/seguridad/senal-preventiva-en-fibra-de-vidrio-4mm-con-lamina-reflectiva-hip/,0,50,25,2024-10-24 22:07:19.529,2024-10-24 22:07:42.531
0e947660-4a30-4f1a-a74f-d2d5fac52296,"Rollo de Cinta reflectiva 4""x45.7mts color blanco - Reflexlite",CR4-REF-BL,CR4-REF-BL,rollo,cintas seguridad,,0,280,280,2023-08-03 03:38:19.427,2023-08-03 03:38:19.427
0e95ffaa-a5ba-432f-a008-ebf0e5b7dee5,Señal fotoluminiscente soporte: acrilico 2 mm lamina: fotoluminiscente 5 hrs pictograma: vinil rotulado,AFT,AFT,20x30cm,fotoluminiscente,,0,15,7,2023-08-03 03:38:19.427,2023-08-03 03:38:19.427
0eacf261-f474-4704-928c-3e0d9a864a80,Lámina reflectiva Alta Intensidad Prismático (3930 HIP) BLANCO AMBAR 1.22Mx45.7M -  3M,R120-3M-BL,R120-3M-BL,Rollo,viniles,,0,8300,7222,2024-12-18 15:05:33.235,2024-12-26 17:24:51.244
0f8792ff-0698-4c61-ae01-4336fff30b4e,"Cinta reflectiva grado ingeniería 2"" x 45.7M, color amarrillo - Reflexlite",CIAN,CIAN,rollo,cintas seguridad,https://tellsenales.com/seguridad/cinta-senalizacion-grado-ingenieria-amarillo-negro/,0,50,30,2024-10-29 14:52:40.549,2024-10-29 14:53:33.799
0faea73e-a0d8-46c9-8fe1-e5fe5bd4a463,"Señal para obras marco de madera con liston de 2x2"" + banner de 12 onzas templado",BNM-2,BNM-2,60x80cm,obras,,0,0,0,2023-08-03 03:38:19.427,2023-08-03 03:38:19.427
0ff18cfb-6c4b-40b8-a41f-52cb6c0885c5,"Señal Vertical Preventiva  soporte: fibra de vidrio 4 mm con refuerzo platina 1 1/2"" Lámina: Reflectiva tipo XI Diamond Grade - 3M , Pictograma: Reflectivo grado ingeniería",FDP60,FDP60,60x60cm,viales,https://tellsenales.com/seguridad/senal-preventiva-en-fibra-de-vidrio-4mm-con-lamina-reflectiva-hip/,0,230,180,2023-08-03 03:38:19.427,2025-01-30 23:46:52.471
112d61cc-ae24-44de-9cbf-9babc655f240,Señal para obras vinil chino aplicado en soporte Trupan MDF Genérico 4mm,TRUCH40X60,TRUCH40X60,40x60cm,obras,https://tellsenales.com/seguridad/senales-temporales-vinil-con-soporte-triplay-4mm-para-obras-y-construccion/,0,12.5,7.5,2024-09-20 23:52:28.697416,2024-09-20 23:53:07.756
11b537c7-fc18-44e1-aa43-a37cef23de97,Rótulos magnéticos  ( vinil laminado con protección UV aplicado sobre lámina imantada de 0.8mm ) para vehículos y otros usos,im-8,im-8,30x40cm,seguridad,,0,30,15,2024-03-19 14:38:20.261,2024-03-19 14:38:20.261
1366365f-86a8-4e35-a24f-6ed83e4224f2,"Panel compuesto de aluminio - substrato de aluminio (PAL ) 5mm ",PAL-5MM,PAL-5MM,240x120cm,seguridad,https://tellsenales.com/seguridad/panel-aluminio-compuesto-sustrato-de-aluminio-4mm/,0,320,239,2024-07-01 21:22:21.17,2024-08-24 22:42:20.896
1465d11f-96e1-4739-aae7-7e5a9b2677a2,Señal acrílico de 2mm con pictograma impresión vinil Arclado con laminado blanco aplicado al espejo,AC20X30-2,AC20X30-2,20x30cm,articulos seguridad,https://tellsenales.com/seguridad/senales-en-acrilico-en-diferente-espesores-2mm-or-3mm-or-5mm/,0,12,6,2024-06-20 21:46:36.504,2024-08-24 23:11:15.778
14fd6cdc-9b0b-4c2d-9074-f720d299f767,"Parante con base de concreto 40x40cm, liston 2"" x 2"" x 3 M.  - Pintando base zincromato + gloss patrón Zebra y Asa de fierro corrugado",PSCA,PSCA,und,obras,https://tellsenales.com/seguridad/parante-para-senalizacion-con-base-de-concreto/,0,80,55,2024-11-03 15:51:38.702,2024-11-03 15:53:53.934
168324b5-f62b-45a8-adc7-cd1f72caa7f1,Letras rotuladas / ploteadas en vinil   + transfer de papel,rot,rot,20x10cm,seguridad,,0,4,1,2024-02-27 19:54:18.408,2024-02-27 19:54:18.408
17447334-1ff5-4fc5-a150-955ebad6713a,BOTELLA LAVAOJO INDIVIDUAL DE 500 ml (D001-100) - marca Hawls Avlis,LVO-500,LVO-500,und,epp,https://tellsenales.com/seguridad/botella-lavaojos-haws-avlis-d001-100/,0,105,78,2024-03-07 20:42:12.67,2024-11-03 15:55:42.113
177dfd38-dc3e-46bf-9552-0d6277eeb656,Señal reglamentaria lamina: reflectiva tipo iv alta intensidad prismatico ( hip) pictograma: vinil rotulado,LHIP-R,LHIP-R,60x90cm,viales,,0,100,55,2023-08-03 03:38:19.427,2023-08-03 03:38:19.427
180962fd-156e-40e7-b27a-c230d9adf09e,Señal fotoluminiscente con soporte pvc celtex 3mm  pictograma impresión digital tinta ecosolvente y sobrelaminado incluye cinta de doble contacto,FT20X30-I,FT20X30-I,20x30cm,fotoluminiscente,https://tellsenales.com/seguridad/senal-fotoluminiscente-con-base-pvc-celtex-3mm/,7,10,4,2023-12-05 16:06:32.345,2025-01-16 19:00:54.834
184d40da-7bab-4b44-9d3c-6d630877fa52,Hito kilometrico 1.2 m. con nomenclatura,HI12,HI12,und,viales,https://tellsenales.com/seguridad/poste-o-hito-de-kilometraje/,0,180,120,2023-08-03 03:38:19.427,2024-09-19 20:41:27.29
1887f45a-beba-46c3-9bca-8d0e1a06ede7,Señal CONVENCIONAL Vinil Arclad + sobrelaminado brillo (protección UV) aplicado en soporte PVC celtex de 5 mm,PVC120X80,PVC120X80,120x80cm,convencionales,https://tellsenales.com/seguridad/senal-vinil-laminado-con-base-pvc-celtex-3mm/,8,80,40,2024-08-26 21:56:09.881,2024-09-21 23:47:13.422
1a3c6f24-af44-4fa5-afb9-e7812a4ed964,"Rollo cinta reflectiva tipo i - grado ingenieria 2"" x45.7 mts 3M - color verde",CGI-3M-VD,CGI-3M-VD,rollo,cintas seguridad,https://tellsenales.com/seguridad/cinta-reflectiva-grado-ingenieria-2-x45-7mts-3m/,0,280,200,2023-08-03 03:38:19.427,2024-09-19 20:33:47.503
1a57e744-87c1-44d9-983b-e0822860c9ca,"Cinta reflectiva 2"" x 45.7M. marca Reflexlite, color rojo",CRRJ-2,CRRJ-2,rollo,cintas seguridad,https://tellsenales.com/seguridad/cinta-reflectiva-2-pulgadas-5-cm-x-45-7mts-reflexlite/,0,320,170,2023-08-03 03:38:19.427,2024-08-24 23:23:19.291
1a8dce01-c842-4a7e-8fde-7e0d1561bb2c," Botiquin Lona portatil chico  20cm x 16cm x 5cm , color rojo ",BOTL-CH,BOTL-CH,und,articulos seguridad,https://tellsenales.com/seguridad/botiquin-lona-portatil-chico/,0,25,13,2024-08-16 16:13:26.246827,2024-08-16 16:13:26.246827
1a9c7bba-6d60-4c6b-a28e-2b24c4008733,Costo de envio ( Delivery ),DEL,DEL,und,servicio,,0,15,15,2023-08-03 03:38:19.427,2023-08-03 03:38:19.427
1b13a465-e323-4cfe-b0de-45cf849c9bcb,"Poste metálico tubo redondo Ø2.5""  x  2mm x 3.6M. Pintado: doble capa anticorrosiva y doble capa gloss en patrón zebra ( cada 30cm ) - incluye accesorios pernos, tuercas, arandelas y anclaje",PS2X2X3.6,PS2X2X3.6,und,viales,https://tellsenales.com/seguridad/postes-metalicos-para-senalizacion-vial-duraderos-visibles-y-versatiles/,0,145,120,2024-01-05 13:56:45.751,2024-08-26 21:07:45.775
1bde10e7-a979-43fe-a9ed-2faca91c4718,Postes delineadores  de concreto de 1Metro,PDEL,PDEL,und,viales,,0,60,80,2024-11-04 15:48:53.321315,2024-11-04 15:48:53.321315
1dabeaa0-3e5e-4ba3-8c29-a953d8efdd56,Sticker vinil troquelado con transfer de papel,STRO,STRO,und,seguridad,https://tellsenales.com/seguridad/sticker-vinil-troquelado-con-transfer-de-papel/,0,1,2,2024-09-19 21:46:49.270779,2024-09-19 21:46:49.270779
1e1ccce3-6105-4648-b997-cfc6c456dc27,"Cinta de doble contacto SCOTCHMOUNT 3/4"" x 33Mts 3M 4016",CD4016,CD4016,rollo,cintas seguridad,https://tellsenales.com/seguridad/rollo-cinta-de-doble-contacto-scotchmount-3-4-x-33mts-3m-4016/,0,180,160,2023-08-03 03:38:19.427,2024-08-24 22:59:37.571
1e8a4c7d-6fbe-4da1-8657-719520030396,"Tacho basculante en fibra de vidriio 3mm , diametro: 45cm , capacidad: 80L , Alto 75cm",TBAS45,TBAS45,und,seguridad,,0,500,400,2024-08-14 14:59:41.294254,2024-08-14 14:59:41.294254
1f3392e4-53b1-497d-b6bd-72bedf668b27,"Señal vertical informativa con lamina reflectiva tipo IV Alta Intensidad Prismático (HIP) , letras y marco Reflectivo Grado Ingenieria(GI) con soporte compuesto de aluminio  4mm",SHI80X30,SHI80X30,80x30cm,viales,https://tellsenales.com/seguridad/senales-informativas-para-calles-con-lamina-reflectiva-y-soporte-compuesto/,9,85,54,2023-08-03 03:38:19.427,2024-08-24 22:47:08.847
203f66ef-366b-4c00-99c5-2137639f4321,"Cono de seguridad de 28 pulgadas ( 70 cm ) incluye cinta reflectiva ",CN-28,CN-28,und,proteccion vial,,0,35,23,2023-08-03 03:38:19.427,2023-08-03 03:38:19.427
20b6f666-9796-4eac-a1fc-4ae29219a2ef,"Cadena plástica amarillo - negro  ",cad,cad,metro,seguridad,,0,10,6,2023-09-07 21:03:28.576,2023-09-07 21:03:28.576
2397a543-3978-490f-8601-2176be7306ff,Luces de emergencia 24 led schubert original,LE-SCH-24,LE-SCH-24,und,articulos seguridad,https://tellsenales.com/seguridad/luz-de-emergencia-schubert/,0,65,40,2023-08-03 03:38:19.427,2024-09-06 20:08:11.946
24f8e384-10b0-43ef-a8f0-e7994272c44e,Gabinete contra incendio de 9 - 12kg ( 38.5 x 81cm x 23cm),GAB12,GAB12,und,lucha contra incendio,,0,100,65,2024-06-17 22:32:49.058,2024-06-17 22:32:49.058
26687d94-4b06-4dac-9c25-9a5cab082bd6,Señal Vertical Preventiva Lámina: Reflectivo tipo IV Alta Intensidad Prismático  3M (HIP) Soporte: Panel Aluminio Compuesto 4mm Pictograma: Reflectivo Grado Ingeniería,SHP60-3M,SHP60-3M,60x60cm,viales,https://tellsenales.com/seguridad/senal-preventiva-con-lamina-de-alta-intensidad-hip-y-soporte-sustrato-de/,9,140,88,2025-01-03 02:41:15.945,2025-01-03 02:58:11.421
27479d64-6c53-42b5-807b-1ac58c954c04,"Contador de días sin accidentes fabricando con soporte compuesto de aluminio 4mm, impresión vinil laminado ( protección UV) y perfiles de aluminio para numeración.",CON-PAL60X90,CON-PAL60X90,90x60cm,seguridad,https://tellsenales.com/seguridad/letrero-informativo-contador-de-dias-sin-accidentes-en-acrilico/,0,220,121,2024-03-19 14:31:17.239,2024-09-06 19:49:12.29
27769d45-dab5-49d7-a7d1-2826cdbb1e46,"Fibra de vidrio 4 mm con refuerzo platina 1 1/2"" ( perforacion de 3/8 "" )",FIB60X60,FIB60X60,60x60cm,viales,https://tellsenales.com/seguridad/placa-fibra-de-vidrio-60x60-cm-de-4mm-con-resina-poliester/,0,72,57.6,2023-08-03 03:38:19.427,2024-10-15 16:28:51.167
2a9349a1-4715-4cbe-a17e-5a263f068e51,Impresion Reflectivo Grado Ingenieria de 1.2mts ( precio por metro lineal ),imp-gi,imp-gi,120x100cm,seguridad,,0,100,75,2024-03-22 17:47:53.489,2024-03-22 17:47:53.489
2af7273e-bf8d-4b7d-bd52-7336e9666d51,"Poste de metálico tubo redondo de 3"" x 2.5mm x 3.5 M pintado base zincromato + gloss ( zebra cada 30cm) incluye anclaje , pernos tuercas, arandelas",PS3X2.5X3.5,PS3X2.5X3.5,Und,viales,https://tellsenales.com/seguridad/postes-metalicos-para-senalizacion-vial-duraderos-visibles-y-versatiles/,0,165,130,2023-10-19 01:08:02.594,2024-08-26 21:08:34.507
2ba41bb1-78fe-415a-9cbe-0ea92e14dc47,Filtro 2097 - 3M,F2097-3M,F2097-3M,Und,epp,,0,70,35,2024-05-07 23:43:42.128,2024-05-08 04:02:54.567
2c51dd07-8d87-43d8-a34e-8060bd097f43,Señal Vertical Preventiva Lámina: Reflectivo tipo IV Grado Prismático (HIP) Soporte: Panel Aluminio Compuesto 4mm Pictograma: Reflectivo Grado Ingenieria,SHP30,SHP30,30x30cm,viales,https://tellsenales.com/seguridad/senal-preventiva-con-lamina-de-alta-intensidad-hip-y-soporte-sustrato-de/,9,45,16,2024-01-02 18:38:07.927,2025-01-02 19:38:17.025
2c78bd9f-5eb7-4c03-be9e-dc643083cec9,Sticker vinil arclad transparente laminado,STT20X30,STT20X30,20x30cm,seguridad,https://tellsenales.com/seguridad/sticker-vinil-arclad-laminado-proteccion-uv/,0,3,3,2023-08-03 03:38:19.427,2024-11-08 19:33:52.977
2c7dd38a-4bdb-4ef2-8262-67ee83227812,Botiquín de madera 20 x30 cm - Sin medicamentos,BOT20X30,BOT20X30,und,articulos seguridad,https://tellsenales.com/seguridad/botiquin-de-madera-20x30cm/,0,25,15,2023-08-03 03:38:19.427,2024-08-24 22:31:32.945
2c9d88e1-b7dd-4a62-ab0f-a971cb960c95,Topellantas de estacionamiento fabricando con caucho 100% reciclado Medida: 180x15x10CM,TLL180,TLL180,und,proteccion vial,https://tellsenales.com/seguridad/topellantas-de-caucho-para-estacionamientos-de-180cm/,0,220,165,2024-08-06 22:48:56.362234,2024-09-19 20:22:49.65
2cde030f-3b35-4df0-ac83-46e58d36a498,Señal STICKER FOTOLUMINISCENTE de 5 hrs pictograma: vinil rotulado,SFT20X30,SFT20X30,20x30cm,fotoluminiscente,https://tellsenales.com/seguridad/sticker-fotoluminiscente-con-pictograma-vinil-rotulado/,0,7,3,2023-08-03 03:38:19.427,2024-10-17 21:15:11.553
2d13aa66-99ef-49bd-a9dc-a42371bd73e1,Señal Chevrón Lámina: Reflectivo tipo XI Grado Diamante (3M DG3)  Soporte: Fibra de vidrio 4mm Pictograma: Reflectivo Grado Ingenieria,CHE40X60-F-DG3,CHE40X60-F-DG3,40x60cm,viales,https://tellsenales.com/seguridad/senal-preventiva-chevron-con-lamina-reflectiva-hip-con-soporte-compuesto-de/,0,165,113,2025-01-03 04:34:57.139,2025-01-03 04:46:31.478
2d2fce5d-899c-4db1-ab51-fd1d4a4392ee,Señal fotoluminiscente con soporte pvc celtex 5 mm y pictograma en vinil rotulado (troquelado),FT60X80-5,FT60X80-5,60x80cm,fotoluminiscente,https://tellsenales.com/seguridad/senal-fotoluminiscente-con-base-pvc-celtex-3mm/,0,64,32,2023-10-22 23:12:55.748,2024-08-24 23:01:51.125
2d84fe5b-6ffc-40a4-8917-c9ccc8b24fe5,Lámina reflectiva amarillo limón tipo XI Grado Diamante (DG3) 3M con pictograma rotulado en vinil color negro,FDG3,FDG3,30 X45,viales,,0,95,72,2024-05-14 16:51:02.699,2024-05-14 16:51:02.699
2d9347f4-ad1f-41c8-b8f5-ecc62b5026a2,"Poste metálico tubo redondo Ø2.5""  x  2mm x 3M. Pintado: doble capa anticorrosiva y doble capa gloss en patrón zebra ( cada 30cm ) - incluye accesorios pernos, tuercas, arandelas y anclaje",PS2X2X3,PS2X2X3,und,viales,https://tellsenales.com/seguridad/postes-metalicos-para-senalizacion-vial-duraderos-visibles-y-versatiles/,9,120,95,2023-10-21 16:29:41.788,2024-08-26 21:07:52.312
2e2a7320-42f8-4cc7-9d01-465fdd169bc3,Señal reguladora con lamina reflectiva  tipo IV Alta Intensidad Prismático (HIP ) y soporte fibra de vidrio 4mm  con refuerzo de platina  ( PARE ),FHR75X75,FHR75X75,75x75cm,viales,https://tellsenales.com/seguridad/senal-pare-octagonal-con-lamina-reflectiva-hip-en-fibra-de-vidrio-4mm-o/,0,220,175,2024-05-21 16:36:40.957,2024-08-24 22:49:14.538
2f8030ed-4371-4676-a9b6-648382eb37e3,Señal vinil arclad laminado (proteccion UV) c/ soporte pvc celtex espesor = 5mm - DOBLE CARA,PVC-5-DC,PVC-5-DC,20x30cm,seguridad,,0,8,4,2023-08-03 03:38:19.427,2023-08-03 03:38:19.427
3002bb75-0149-4c15-b1c6-cdb03443ab60,Extintor CO2 (Dióxido de Carbono )-10 libras con certificado,C02-10,C02-10,und,lucha contra incendio,https://tellsenales.com/seguridad/extintor-c02-de-10-lbs/,0,300,250,2023-08-03 03:38:19.427,2025-01-28 22:13:16.488
3036364b-0ae8-4965-9cb6-ee5ad5624207,Señal fotoluminiscente con soporte pvc celtex 5mm y pictograma en vinil rotulado (troquelado),FT40X60-5,FT40X60-5,40x60cm,fotoluminiscente,https://tellsenales.com/seguridad/senal-fotoluminiscente-con-base-pvc-celtex-3mm/,0,32,16,2024-05-30 21:21:38.593,2024-08-24 23:01:08.494
3039d654-3b17-4a44-9fd3-02d55957d8a7,Luces de emergencia 14 led opalux original,LE-OPA-14,LE-OPA-14,und,articulos seguridad,https://tellsenales.com/seguridad/luz-de-emergencia-14-led-power-modelo-slim-8-hrs/,0,85,85,2023-08-03 03:38:19.427,2024-09-19 21:18:54.134
3130a1c2-bb8d-46e3-9e7e-7a9fe915b01e,"Cinta reflectiva 2"" x 45.7M. marca Reflexlite, color verde",CRVD-2,CRVD-2,rollo,cintas seguridad,https://tellsenales.com/seguridad/cinta-reflectiva-2-pulgadas-5-cm-x-45-7mts-reflexlite/,0,150,92,2023-09-05 22:25:22.419,2024-08-24 23:24:06.559
31495c0c-5177-4239-9914-7796bb234778,Topellantas de estacionamiento fabricando con caucho 100% reciclado Medida: 55x15x10CM,TLL55,TLL55,und,proteccion vial,https://tellsenales.com/seguridad/topellantas-de-caucho-para-estacionamientos-de-55cm/,0,70,45,2023-08-03 03:38:19.427,2024-09-19 20:22:13.799
3175c5d0-21e6-4354-a1d8-fd2c36c38bd6,"Extintor tipo ""K"" acetato de potasio ( 2.5 gal  / 9 litros ) - IMPORTADO",EXK-9,EXK-9,und,lucha contra incendio,https://tellsenales.com/seguridad/extintor-de-clase-k-acetato-de-potasio/,0,320,260,2024-08-21 15:06:21.758808,2024-09-19 20:14:56.421
31d8679d-41af-4ce2-84d0-471774b147fe,Señal vertical preventiva con soporte compuesto de aluminio 4mm +  lamina reflectiva tipo I Grado Ingeniería (GI) + pictograma vinil rotulado,sgp30,sgp30,30x30cm,viales,,0,32,12,2024-01-02 18:55:55.04,2024-01-02 18:55:55.04
31f54f45-c815-4059-a15f-54161474f7c8,"Caja x 30 unds cinta de doble contacto 19mm x 33mts - verde Escocés  - Astara ",CD-AST-BOX,CD-AST-BOX,Caja,cintas seguridad,https://tellsenales.com/seguridad/cinta-doble-contacto-19mm-x-33mts-astara/,0,700,375,2024-04-03 00:08:49.541,2024-08-24 22:56:06.933
335408f9-e86b-4e0f-a071-02eb03ad6c21,VINIL FOTOLUMINISCENTE verde brilloso 61cm x 45.7M - Reflexlite,R60-FTB,R60-FTB,Rollo,viniles,https://tellsenales.com/seguridad/vinil-fotoluminiscente-verde-brilloso-61cm/,0,1100,810,2023-09-13 15:37:10.627,2024-11-06 22:00:12.832
3375d9ae-f742-4e05-ac69-5a21275d09e1,"Poste de señalización ( fierro galvanizado ) 2"" Ø x 3M. Pintado: doble capa anticorrosiva y doble capa  gloss en patron zebra ( cada 30cm ) - incluye accesorios pernos, tuercas, arandelas y anclaje",PSG2X2X3,PSG2X2X3,und,viales,https://tellsenales.com/seguridad/postes-metalicos-para-senalizacion-vial-duraderos-visibles-y-versatiles/,0,150,110,2023-08-03 03:38:19.427,2024-08-26 21:08:45.775
34b97acb-f47c-458e-b688-c4cabe1e6865,Juego de Plantilla Alfabeto en aluminio  offset de 0.3MM [ A - Z ],PLA-A10,PLA-A10,10cm,seguridad,https://tellsenales.com/seguridad/plantilla-de-alfabeto-metalicos-para-pintar-de-a-z/,0,90,60,2024-05-09 21:13:43.412,2024-08-24 22:36:07.712
3502b63b-9e0e-4da1-ae0c-b729c7fd1803,Señal fotoluminiscente con soporte pvc celtex 3 mm y pictograma en vinil rotulado (troquelado),Ft60x30,Ft60x30,60x30cm,fotoluminiscente,,7,21,9,2023-10-22 23:13:37.024,2023-10-22 23:13:37.024
